company_name,prefecture,website,inquiry_url,notes,industry
コメジ・ソシオ株式会社,,https://www.comeji-socio.co.jp/,https://www.comeji-socio.co.jp/contact/,,エネルギー業界
サーラエナジー株式会社,,https://www.salaenergy.co.jp/corporation/company/profile/,https://www.salaenergy.co.jp/form/inquiry/,,エネルギー業界
サミット半田パワー株式会社,,https://www.summit-handa-power.co.jp/company/,https://www.summit-handa-power.co.jp/inquiry/,,エネルギー業界
株式会社ムダカラ,,https://mudakara.co.jp/about/profile/,https://mudakara.co.jp/contact/,,エネルギー業界
株式会社エネチタ,,https://www.enechita.co.jp/about-enechita,https://tsunagukun.jp/s/EndySjzZ/form?ss=C4D39B60-A11E-11F0-8B14-D8A1780B4F4E,,エネルギー業界
株式会社アスク,,https://www.ask-aichi.com/company,https://www.ask-aichi.com/contactus,,エネルギー業界
株式会社エネ・ビジョン,,https://www.enev.co.jp/company/outline.html,https://www.enev.co.jp/contact/,,エネルギー業界
中川物産株式会社,,https://nakagawa-bussan.co.jp/company/profile,https://nakagawa-bussan.co.jp/contact/,,エネルギー業界
ニイミ産業株式会社,,https://www.niimi-s.co.jp/company/outline/,お問い合わせ | ニイミ産業株式会社,,エネルギー業界
名古屋シェル石油販売株式会社,,https://nagoya-shell.co.jp/about/outline.html,https://nagoya-shell.co.jp/contact/index.html,,エネルギー業界
東邦ガスセイフティライフ株式会社,,https://www.ecolifeplus.jp/company/,https://www.ecolifeplus.jp/quotation/,,エネルギー業界
岩崎酸素株式会社,,https://www.iwasaki-sanso.jp/html/company.html,https://www.iwasaki-sanso.jp/contact/index.cgi,,エネルギー業界
中島商事株式会社,,https://www.nakajima-group.co.jp/company/,https://www.nakajima-group.co.jp/contact/,,エネルギー業界
みえ水素ステーション合同会社,,https://mie-suiso.co.jp/,https://mie-suiso.co.jp/contact,,エネルギー業界
ジクシス株式会社,,https://www.gyxis.jp/company/office/yokkaichilpg/,https://www.gyxis.jp/contact/,,エネルギー業界
株式会社クレアジャパン,,http://creajapan.jp/,,HPリンクエラー,エネルギー業界
株式会社泉商会,,https://izumienergy.co.jp/,https://izumienergy.co.jp/contact/other-inquiries/contact-other/,,エネルギー業界
横浜石油株式会社,,http://www.ysgholdings.co.jp/yokohama-sekiyu/,http://www.ysgholdings.co.jp/contact-privacy/,,エネルギー業界
株式会社諸星商事,,https://www.morohoshi.co.jp/company/group.html,https://www.morohoshi.co.jp/contact/,,エネルギー業界
有限会社北川燃料店,,https://r.goope.jp/sr-17-1738213089/,,,エネルギー業界
有限会社大屋ホームガス,,https://www.oya-homegas.com/about,,,エネルギー業界
上月プロパンガス共販株式会社,,https://maruigas.biz/kouzuki/,,,エネルギー業界
株式会社 仁尾太陽光発電,,https://www.yondenko.co.jp/corporate/group-niosolar.php,https://www.yondenko.co.jp/inquiry/form.php?type=other,,エネルギー業界
二葉商事株式会社,,http://www.futaba-kensetu.jp/company/history.html#hutabasyouji,https://sv4.xeoserver.jp/www.futaba-kensetu.jp/contact/,営業お断り,エネルギー業界
八戸東邦アセチレン株式会社,,https://www.toho-ace.co.jp/com/group.html,https://www.toho-ace.co.jp/contact/contact_form/,,エネルギー業界
株式会社弘前ガス商事,,http://hg-group.co.jp/associated_company/,,,エネルギー業界
JX金属エコマネジメント株式会社,,https://www.nmm.jx-group.co.jp/company/network/internal/,,HPリンクエラー,エネルギー業界
伏木万葉埠頭バイオマス発電合同会社,,https://fushiki-manyou-biomass.jp/,https://krs.bz/fushiki-bio/m/contact,,エネルギー業界
有限会社サキモト,,http://www.sakimoto-sg.co.jp/company/index.html,,HPリンクエラー,エネルギー業界
株式会社阿部八商店,,https://abehachi.com/,,,エネルギー業界
日本コークス工業東北株式会社,,https://www.n-coke.com/,https://www.n-coke.com/contact/,,エネルギー業界
株式会社辰巳商会,,http://tazmi-s.co.jp/,http://tazmi-s.co.jp/contact/,,エネルギー業界
富士オイルサービス株式会社,,https://www.fuji-oil.com/,https://www.fuji-oil.com/contactus,営業お断り,エネルギー業界
株式会社アクアパワー東北,,http://www.magoishi.ap-tohoku.co.jp/,,,エネルギー業界
株式会社いわせき,,http://www.iwaseki.co.jp/index.shtml,,HPリンクエラー,エネルギー業界
北燃商事株式会社,,https://www.hokunen.jp/about/company/,https://www.hokunen.jp/contact/,,エネルギー業界
セントラルLNGマリンフューエル社,,https://central-lng.com/,https://central-lng.com/contact/,,エネルギー業界
スマートエナジー熊本株式会社,,https://se-kumamoto.co.jp/,https://se-kumamoto.co.jp/contact/,,エネルギー業界
株式会社エフオン壬生,,https://www.ef-on.co.jp/corporate/outline/efon_mibu/,https://www.ef-on.co.jp/contact/,,エネルギー業界
株式会社さくら新電力,,https://www.sakura-energy.com/,https://www.sakura-energy.com/contact/,,エネルギー業界
アストマックス・エネルギー株式会社,,https://astmaxenergy.co.jp/,https://astmaxenergy.co.jp/inquiry/,,エネルギー業界
株式会社U-POWER,,https://u-power.jp/company/#outline,https://u-power.jp/inquiry/,,エネルギー業界
王子グリーンエナジー白糠株式会社,,https://www.ojiholdings.co.jp/group/groupcompany/,https://www.ojiholdings.co.jp/contact/other/,,エネルギー業界
愛知クリーンエナジー株式会社,,http://toyokawa-purification-center.com/,,HPリンクエラー,エネルギー業界
地域分散型電源株式会社,,https://dearsolar.jp/,https://dearsolar.jp/contact.html,,エネルギー業界
三崎ウィンド・パワー株式会社,,https://www.yonden.co.jp/corporate/yonden/group/misaki_wind.html,https://www.yonden.co.jp/inquiry/other/index.html,,エネルギー業界
株式会社はつかいち環境サービス,,https://www.hatsukaichi-ene-clean.com/,,,エネルギー業界
しまなみ石油株式会社,,https://www.shimanamisekiyu.com/,,,エネルギー業界
福山未来エナジー株式会社,,https://fukuyama-miraienergy.co.jp/,https://fukuyama-miraienergy.co.jp/contact/inquiry/,,エネルギー業界
株式会社美作国電力,,https://mimaden.jp/,https://mimaden.jp/contact/,,エネルギー業界
NXエネルギー中部 株式会社,,https://www.nittsu-ene-chubu.com/company/,https://www.nittsu-grp-contact.com/contact/chubu/,,エネルギー業界
北ガスライフロント株式会社,,https://www.hokkaido-gas.co.jp/chintai/efute/,,,エネルギー業界
神栖バイオマス発電所合同会社,,https://kamisubiomass.com/,https://docs.google.com/forms/d/e/1FAIpQLSezg0au6FQcdutD5i7sXJu-SJxld8eQYA_pTI0YNIpUktbNGA/viewform,,エネルギー業界
神鋼エア・ウォーター・ガス株式会社,,https://www.awi.co.jp/ja/company/group.html,https://reg31.smp.ne.jp/regist/is?SMPFORM=nanh-ldkdpa-1cf3691fc1d59ab0341b275429163938&_gl=1*1ylwd17*_ga*MTIzMjcxNTI2MC4xNzYwMjkyMjUw*_ga_B8HL178GVT*czE3NjAyOTIyNTAkbzEkZzEkdDE3NjAyOTIyODQkajI2JGwwJGgw,,エネルギー業界
ANPケミカルズ株式会社,,https://www.anp.co.jp/company/offices,https://www.anp.co.jp/contact/general?type=9,,エネルギー業界
阪奈堀川ガス株式会社,,https://www.horikawasangyo.co.jp/keiretu.htm,https://www.horikawasangyo.co.jp/qaform.htm,,エネルギー業界
有限会社 永野商店,,https://naganogas.com/,,,エネルギー業界
大阪ガスネットワーク株式会社,,https://network.osakagas.co.jp/company/profile.html,https://network.osakagas.co.jp/form/inquiry/index.html,,エネルギー業界
株式会社サイサンホームサービス,,https://saisan-hs.com/,https://saisan-hs.com/postmail/index.html,,エネルギー業界
岩渕液化ガス株式会社,,https://iwabuchi-lpg.com/company/,,,エネルギー業界
株式会社 鈴商総合ガスセンター,,https://www.suzukishokan.co.jp/kanren/index.html,https://www.suzukishokan.co.jp/contact11.html,,エネルギー業界
東和エネルギーソリューション株式会社,,https://towa-esol.jp/company/#outline,https://towa-esol.jp/contact/,,エネルギー業界
合同会社グリーンアース,,https://g-earth.jp/,https://g-earth.jp/%E3%81%8A%E5%95%8F%E3%81%84%E5%90%88%E3%82%8F%E3%81%9B/,,エネルギー業界
大多喜ガスパートナー株式会社,,https://www.k-and-o-energy.co.jp/group/,,,エネルギー業界
TNクロス株式会社,,https://www.tncross.co.jp/,,,エネルギー業界
株式会社創喜,,https://www.souki1.site/,,HPリンクエラー,エネルギー業界
埼玉酸素株式会社,,https://www.saisan.net/saitamasanso/,,,エネルギー業界
飯舘バイオパートナーズ株式会社,,http://www.iitate-bp.co.jp/index.html,,,エネルギー業界
株式会社大林クリーンエナジー,,https://www.ocenergy.co.jp/company.html,,,エネルギー業界
株式会社シナネンひまわりサービスセンター,,https://www.melife.co.jp/himawari-service/,https://www.melife.co.jp/procedure/other/,,エネルギー業界
株式会社DK-Power,,https://www.dk-power.co.jp/,https://www.dk-power.co.jp/#contact,,エネルギー業界
レネックス電力合同会社,,https://solar-mate.jp/,https://solar-mate.jp/smm-contact-blog/,,エネルギー業界
株式会社シーブリーズデザイン,,https://seabreeze-design.com/,,,エネルギー業界
株式会社アストモスガスセンター千葉,,https://astomos-logistics.jp/agcchiba/,,,エネルギー業界
株式会社エナリスパワー,,http://eneres-power.co.jp/,,HPリンクエラー,エネルギー業界
株式会社パワー・オプティマイザー,,https://poweroptimizer.co.jp/,https://poweroptimizer.co.jp/contact/,,エネルギー業界
戸ノ口堰小水力発電株式会社,,https://www.tonokuchi-suiryoku.com/,https://www.tonokuchi-suiryoku.com/contact/,,エネルギー業界
えちてんリニューアブルエナジー株式会社,,https://www.echiten-gas.co.jp/company/offices/,,,エネルギー業界
株式会社カワハタサイクルシステムズ,,https://www.kcyclesystems.co.jp/index.html,,,エネルギー業界
有限会社 田中剛産業,,https://www.tanakagas.com/,https://www.tanakagas.com/mailpro/index.html#pp_mailform,,エネルギー業界
プロップテック株式会社,,https://www.xn--bck3d8a4h721p04j2t8h.net/,https://docs.google.com/forms/d/e/1FAIpQLSfXkhWzMWbgdAUYDV0xg5VZ3vbHzl4WCT3f9iT4DIa1GLeXtQ/viewform,,エネルギー業界
森田物産有限会社,,https://morita-bussan.com/company/,https://morita-bussan.com/contact/,,エネルギー業界
京セラグリーンイノベーション合同会社,,https://www.kyocera.co.jp/newsroom/news/2023/002212.html,,,エネルギー業界
株式会社Ｇダ・ヴィンチ,,https://g-davinci.jp/,,,エネルギー業界
株式会社Legacia,,https://legacia.net/,https://legacia.net/contact/,,エネルギー業界
合名会社クラウドナイン,,https://cd9-llc.com/,,,エネルギー業界
岩谷コスモ水素ステーション合同会社,,https://www.iwatani-cosmo-hyss.co.jp/,,,エネルギー業界
株式会社N.works,,https://www.n-works0101.com/company,https://www.n-works0101.com/contact,,エネルギー業界
長沢住宅設備株式会社,,https://nagasawa-js.evolution.jp/,,,エネルギー業界
株式会社 埼エネコーポレーション,,https://www.saiene.co.jp/company-profile/,https://www.saiene.co.jp/inquiry/,,エネルギー業界
日本複合材料株式会社,,https://www.ncm-y.co.jp/company.html,,,エネルギー業界
山陰プロパン株式会社,,http://san-pro.info/,http://san-pro.info/contact/,,エネルギー業界
株式会社MR・ダイケンシステムズ,,https://daiken8888.sakura.ne.jp/,,,エネルギー業界
株式会社クラッセル兵庫 武庫之荘ガスの店,,https://clasel.net/mukonosou.html,https://clasel.net/contact.html,,エネルギー業界
中日本商事株式会社,,https://nakagawa-bussan.co.jp/company/group_in_japan,https://nakagawa-bussan.co.jp/contact/,,エネルギー業界
株式会社 能勢・豊能まちづくり,,https://nose-toyono.com/,https://nose-toyono.com/contact/,営業お断り,エネルギー業界
東京ガスネットワーク株式会社,,https://www.tokyo-gas.co.jp/network/about/profile/index.html,,,エネルギー業界
新地スマートエナジー株式会社,,https://shinchise.com/,https://shinchise.com/contact.html,,エネルギー業界
株式会社エネグリ,,https://www.eneguri.com/,https://docs.google.com/forms/d/e/1FAIpQLSfx0togFWaqjDd2ny9muiiT4Dyy71dqOk-RGKchQBgreYC3Uw/viewform,,エネルギー業界
株式会社このほし,,https://konohoshi.net/,https://konohoshi.net/contact/,,エネルギー業界
時空化学株式会社,,http://www.ziqoo.co.jp/,http://www.ziqoo.co.jp/,,エネルギー業界
ニイヌマ株式会社,,https://www.niinuma.jp/,https://www.niinuma.jp/contact/,,エネルギー業界
株式会社FUコネクト,,https://www.fu-connect.co.jp/,https://www.fu-connect.co.jp/contact,,エネルギー業界
株式会社東北バイオフードリサイクル,,https://www.tohoku-bio.co.jp/,,,エネルギー業界
株式会社みらい地域,,https://miraichiiki.jp/,,,エネルギー業界
東北ワーク株式会社,,https://tohoku-work.com/,https://tohoku-work.com/contact,,エネルギー業界
フロー株式会社,,https://flow.hokkaido.jp/,https://flow.hokkaido.jp/contact.html,,エネルギー業界
合同会社網走バイオマス第2発電所,,https://www.abashiri-bp.com/,,,エネルギー業界
セカイエエナジーソリューション株式会社,,https://sekaie-es.co.jp/,https://sekaie-es.co.jp/contact/,,エネルギー業界
株式会社ソーラーリンクネット,,https://www.solarlink-net.co.jp/,https://www.solarlink-net.co.jp/contact/,,エネルギー業界
有限会社 野田酸素商会,,https://noda-o2.jimdofree.com/,,,エネルギー業界
株式会社 金桝,,https://masuya-ap.co.jp/about/affiliates/affiliates-detail-02/,https://masuya-ap.co.jp/contact/,,エネルギー業界
エコプラス株式会社,,https://eco-p.co.jp/,https://eco-p.co.jp/?page_id=21,,エネルギー業界
ヴィーナ・エナジー洋上風力株式会社,,https://venaenergy.co.jp/company#overview,https://venaenergy.co.jp/contact,,エネルギー業界
エネルギーソリューションズ株式会社,,https://energy-solutions.jp/,https://energy-solutions.jp/,,エネルギー業界
合同会社ときわ水電,,https://www.tokiwasuiden.com/,,,エネルギー業界
株式会社モッタイナイ・エナジー,,http://mottainai-energy.com/,http://mottainai-energy.com/contact/,,エネルギー業界
株式会社 SAA HAJIMEYO,,https://saa-hajimeyo.co.jp/,,,エネルギー業界
二本松ご当地エネルギーをみんなで考える株式会社,,https://gochikan.com/,https://gochikan.com/,,エネルギー業界
仙台大倉メガソーラ合同会社,,http://www.okura-megasolar.jp/,,,エネルギー業界
株式会社フジテック,,http://energy-labo.jp/,http://energy-labo.jp/form.html,,エネルギー業界
SD MATRIX株式会社,,http://energy-labo.jp/form.html,https://sdmatrix.co.jp/contact,,エネルギー業界
skywalkers株式会社,,https://www.sky-walkers.net/,https://www.sky-walkers.net/form.html,,エネルギー業界
株式会社エレックス東北,,https://www.elechstohoku.co.jp/index.html,https://www.elechstohoku.co.jp/contact_us.html,,エネルギー業界
株式会社 ミトラスコーポラーション,,http://mitoras.com/index.html,http://mitoras.com/contact.html,,エネルギー業界
おきたま新電力株式会社,,https://okitama-e.co.jp/,https://okitama-e.co.jp/contact/,,エネルギー業界
株式会社エネハイム,,https://www.eneheim.co.jp/,https://www.eneheim.co.jp/#contactt,,エネルギー業界
E&Aサービス株式会社,,https://eandas.jp/,https://eandas.jp/contact.html,,エネルギー業界
水戸エナジー株式会社,,https://www.mitoene.co.jp/,https://www.mitoene.co.jp/#contact,,エネルギー業界
株式会社 KOHKEN,,http://www.kohken0206.jp/index.html,http://www.kohken0206.jp/contact.html,,エネルギー業界
F-cology株式会社,,https://www.fcology.com/,https://www.fcology.com/%E3%81%8A%E5%95%8F%E3%81%84%E5%90%88%E3%82%8F%E3%81%9B,,エネルギー業界
東発水力エンジニアリング株式会社,,https://tohatu-suiryoku.com/,,,エネルギー業界
会津エナジー株式会社,,https://aizu-energy.co.jp/,https://aizu-energy.co.jp/contact/,,エネルギー業界
前橋バイオマス発電株式会社,,http://www.maebashi-bio.jp/,,,エネルギー業界
株式会社 SHIGORO. CWP株式会社,,https://shigoro.jp/,https://shigoro.jp/contact//,,エネルギー業界
株式会社Infinity,,https://shigoro.jp/contact/,https://infinity-base-0106.com/contact/,,エネルギー業界
株式会社アドラック,,http://adoluck.co.jp/index.html,,,エネルギー業界
株式会社NATURE RIDER,,https://www.naturerider.com/,https://www.naturerider.com/contact-4,,エネルギー業界
マエノ サービス 株式会社,,https://sites.google.com/view/maeno-service/%E4%BC%9A%E7%A4%BE%E6%83%85%E5%A0%B1,,,エネルギー業界
森林資源バイオエコノミー推進機構株式会社,,https://www.bepa.jp/,https://www.bepa.jp/query/,,エネルギー業界
株式会社 エナテクスPPA,,https://www.enatex.co.jp/company/group/#ppa,https://www.enatex.co.jp/contact/form/,,エネルギー業界
株式会社 AOM,,https://www.aom-japan.com/,https://www.aom-japan.com/contact,,エネルギー業界
株式会社SSTメンテナンス,,https://sst-maint.com/,https://sst-maint.com/,,エネルギー業界
株式会社くらぶち野菜村,,https://k-yasaimura.co.jp/,https://k-yasaimura.co.jp/contact/,,エネルギー業界
株式会社エール特許,,https://yell-patent.jp/,,,エネルギー業界
渡部水力研究所,,https://www.watasuiken.com/,https://www.watasuiken.com/contact,,エネルギー業界
宇都宮ライトパワー株式会社,,https://www.miya-lightpower.co.jp/,https://www.miya-lightpower.co.jp/inquiry/,,エネルギー業界
株式会社 ユーチャリス,,https://eucharis.space/,https://eucharis.space/,,エネルギー業界
Clean&Bee総合企画合同会社,,https://cleanbee.jp/,https://cleanbee.jp/contact/,,エネルギー業界
