company_name,prefecture,website,inquiry_url,notes,industry
株式会社ソーラーケア,,https://www.solarcare.jp/,https://www.solarcare.jp/contact/,,エネルギー業界
AK SERVICE合同会社,,https://akservicejp.com/,https://akservicejp.com/page-ueKVX,,エネルギー業界
エコグリッド株式会社,,https://ecogrid.jp/,https://ecogrid.jp/contact/,,エネルギー業界
合同会社まちづくり元気エナジー,,https://www.mg-energy24.com/,なし,,エネルギー業界
Green Gold Energy in Japan,,https://greengoldenergy.com.au/gge-japan/,https://greengoldenergy.com.au/contacts/,,エネルギー業界
株式会社スマートエナジー,,https://www.smart-energy.jp/,https://www.smart-energy.jp/contact/,,エネルギー業界
クールインテリジェンス株式会社,,https://www.coolintelligence.jp/,https://www.coolintelligence.jp/contact/,,エネルギー業界
株式会社ALLIANCE,,https://www.alliance-corp-nagoya.jp/,https://www.alliance-corp-nagoya.jp/?page_id=19,,エネルギー業界
ガスシステムデザイン株式会社,,https://gas-system-design.jp/,https://gas-system-design.jp/contact/,,エネルギー業界
のぞみエナジー株式会社,,https://nozomi-energy.com/,なし,,エネルギー業界
株式会社うんなん共創エネルギー,,https://ucce-inc.com/,なし,,エネルギー業界
Medipop株式会社,,https://www.jpx-energy.com/,なし,HPリンクエラー,エネルギー業界
株式会社Rara smile,,https://rarasmile.jp/,なし,HPリンクエラー,エネルギー業界
日コン外航ガスタンクケミカル株式会社,,https://www.n-concept.co.jp/pdf/nichikon_gc.pdf,なし,会社紹介pdf,エネルギー業界
株式会社七色技術商会,,https://powerbanknext.com/,なし,HPリンクエラー,エネルギー業界
合同会社インペカブル,,https://impeccallc.com/,https://impeccallc.com/contact-page/,営業お断り,エネルギー業界
株式会社サコダ.WORKS,,https://sakodaworks.com/,https://sakodaworks.com/contact/,,エネルギー業界
株式会社SUN-KAKU,,https://sun-kaku.co.jp/,https://sun-kaku.co.jp/inquiry,,エネルギー業界
Apexx株式会社,,https://yours.energy/,なし,HPリンクエラー,エネルギー業界
株式会社日本エネクス,,https://j-enex.com/,なし,HPリンクエラー,エネルギー業界
Tohoku Sustaina Labo株式会社,,https://tohokusustainalabo.com/,なし,HPリンクエラー,エネルギー業界
千代田エネルギーソリューションズ株式会社,,https://www.cesol.co.jp/,https://www.cesol.co.jp/contact/,営業お断り,エネルギー業界
株式会社ウーダ・エナジー,,https://ooda-energy.com/,https://ooda-energy.com/contact/,,エネルギー業界
大熊るるるん電力株式会社,,https://ookuma-rururun.jp/about/company/,なし,,エネルギー業界
マリーンテック株式会社,,https://www.nkh.co.jp/index.html,なし,,エネルギー業界
株式会社みらいエナジー・パートナーズ,,https://m-e-partners.co.jp/#company,https://m-e-partners.co.jp/#contact,,エネルギー業界
IKGリテール&メディカル株式会社,,https://www.ikgrm.jp/overview.html,なし,HPリンクエラー,エネルギー業界
株式会社グリーンエネルギー九州,,https://www.daiichi-gas.co.jp/corporation/outline/offices/,なし,,エネルギー業界
株式会社ファーストクリエイト,,https://first-create.biz/,なし,,エネルギー業界
岡山ガスライフ株式会社,,http://www.okagas.net/,なし,,エネルギー業界
株式会社FPI,,http://www.fpi-group.jp/,http://www.fpi-group.jp/contactus-gp.html,,エネルギー業界
農業生産法人のずえ農園株式会社,,https://nozuenouen.com/,,HPリンクエラー,エネルギー業界
ECOスタイル株式会社,,https://eco-japan.biz/,https://eco-japan.biz/catalog/,,エネルギー業界
大創株式会社,,http://daiso-rs.com/,http://daiso-rs.com/contact/,,エネルギー業界
日本瓦斯運輸整備株式会社,,http://nicigas-unyu.co.jp/,なし,,エネルギー業界
エヌ・イー・ジャパン株式会社,,https://nara-nichibei.jp/nej/,なし,,エネルギー業界
ふるさとの創成株式会社,,https://furusatono-sousei.co.jp/,https://furusatono-sousei.co.jp/contact/,,エネルギー業界
株式会社Looopコミュニティ,,https://looop-community.com/,https://looop-community.com/contact/,,エネルギー業界
まちのちから合同会社,,https://machinochikara.com/about/,https://machinochikara.com/contact/,,エネルギー業界
双日ケミカルトレーディング株式会社,,https://www.hokkou-kagaku.com/company/,なし,プライバシーエラー,エネルギー業界
株式会社LIXIL TEPCOスマートパートナーズ,,https://www.lixiltepco-sp.co.jp/company/index.html,https://www.lixiltepco-sp.co.jp/tatetoku_form.html#form-area,営業お断り,エネルギー業界
北海道石油ガス株式会社,,https://www.north-oil-gas.co.jp/,https://www.north-oil-gas.co.jp/inquiry.html,,エネルギー業界
富士電機コスモスエナジー合同会社,,https://www.fujielectric.co.jp/feec/,https://form.run/@feec-jp-contact/,,エネルギー業界
福島送電株式会社,,https://www.fukushimasouden.jp/info/,https://www.fukushimasouden.jp/info/,,エネルギー業界
東日本イワタニガス株式会社,,https://www.ign.co.jp/,なし,,エネルギー業界
佐和田発電所株式会社,,https://www.sojitz.com/jp/corporate/group/area/japan/,https://www.sojitz.com/jp/contact/,,エネルギー業界
ティーダッシュ合同会社,,https://t-dash-erex.co.jp/?lang=ja,なし,,エネルギー業界
ENEOSリニューアブル・エナジー・マネジメント株式会社,,https://operations.jre.co.jp/profile/,,HPリンクエラー,エネルギー業界
カニエJAPAN株式会社,,https://kaniejapan.com/company/overview/,https://kaniejapan.com/contact/company/,,エネルギー業界
株式会社エステックス,,https://sasaki-gs.com/about/,https://sasaki-gs.com/contact/,,エネルギー業界
大分地熱開発株式会社,,https://oita-chinetsu.com/,https://oita-chinetsu.com/contact,,エネルギー業界
株式会社オーシャンエナジー,,http://www.ocean-erg.jp/,http://www.ocean-erg.jp/contact/index.html,,エネルギー業界
S&Cソリューションズ株式会社,,https://www.tokyogas-es.co.jp/sc/index.html,なし,,エネルギー業界
株式会社岩手ウッドパワー,,https://morinodenryoku.co.jp/iwp/,https://morinodenryoku.co.jp/contact/,,エネルギー業界
うすきエネルギー株式会社,,https://usuki-energy.com/,https://usuki-energy.com/contact/,,エネルギー業界
株式会社上田自然食品,,https://ion-gas.jp/,なし,HPリンクエラー,エネルギー業界
株式会社山卯,,https://yamau-gas.jp/company/,なし,HPリンクエラー,エネルギー業界
東鉄アシスト株式会社,,https://www.tohsyoh.jp/,なし,,エネルギー業界
JR九州電気システム株式会社,,https://www.kdsnet.co.jp/company/company.php,なし,,エネルギー業界
株式会社ツバメガス熊本,,http://www.lpg.co.jp/index.html,なし,HPリンクエラー,エネルギー業界
日本海産商株式会社,,http://www.nihonkai-sansho.co.jp/,http://www.nihonkai-sansho.co.jp/contact/,,エネルギー業界
島田ガス株式会社,,https://www.shimadagas.co.jp/05_corporation/index.html,なし,,エネルギー業界
イワタニ北陸株式会社,,https://www.iwatani-hokuriku.co.jp/company_cat,https://www.iwatani-hokuriku.co.jp/form/inquiry.php,,エネルギー業界
イワタニ山陰株式会社,,https://www.iwatani-sanin.co.jp/,https://www.iwatani-sanin.co.jp/form/inquiry.php,,エネルギー業界
株式会社デンカシンキ,,https://www.f-s-p.co.jp/,https://www.f-s-p.co.jp/contact.php,,エネルギー業界
大和酸素工業株式会社,,https://www.daiwaox.jp/,https://www.daiwaox.jp/contact/,,エネルギー業界
イワタニ東北株式会社,,https://www.iwatani-tohoku.co.jp/company_cat,https://www.iwatani-tohoku.co.jp/form/inquiry.php,,エネルギー業界
株式会社一戸森林資源,,https://www.fujikoh-net.co.jp/service/wood,https://www.fujikoh-net.co.jp/%e3%81%8a%e5%95%8f%e3%81%84%e5%90%88%e3%82%8f%e3%81%9b/,,エネルギー業界
栃木鉱山環境開発株式会社,,https://t-med.co.jp/,なし,サイトログインが必要,エネルギー業界
株式会社グリージョン,,http://www.somagas.jp/,https://somagas.securesite.jp/site/contact,,エネルギー業界
熱原トラスト株式会社,,https://www.netsugen.co.jp/company/netsugen-obihiro/,https://www.netsugen.co.jp/contact/,営業お断り,エネルギー業界
第一熱原株式会社,,https://www.netsugen.co.jp/company/daiichi-netsugen/,https://www.netsugen.co.jp/contact//,営業お断り,エネルギー業界
イワタニ北海道株式会社,,https://www.iwatani-hokkaido.jp/company_cat,https://www.iwatani-hokkaido.jp/form/inquiry_area.html,,エネルギー業界
株式会社エム・ティ・ジ・エンジニアリング,,https://kkmtgi.com/about/,なし,,エネルギー業界
東南貿易株式会社,,https://www.tonan-trading.com/corporate/outline/,なし,,エネルギー業界
アブダビ石油株式会社,,https://www.cts-co.net/adoc/company/,なし,,エネルギー業界
地域エネルギー開発株式会社,,https://c-energy.co.jp/,https://c-energy.co.jp/contact/,,エネルギー業界
セントラル産業株式会社,,http://www.central-sangyo.com/,http://www.central-sangyo.com/contact/formmail.html,,エネルギー業界
有限会社キミヤホームヒーティング,,https://kimiyahomeheating.wixsite.com/home,https://kimiyahomeheating.wixsite.com/home/contact,,エネルギー業界
有限会社染井商店,,https://somei-shouten.com/index.html,https://somei-shouten.com/contact.html,,エネルギー業界
伊藤忠エネクスホームライフ株式会社,,https://nishi-nihon.enexhl.jp/company/,https://enexhl.jp/contact/general/chugoku,,エネルギー業界
有限会社中本商店,,http://w01.tp1.jp/~a355645358/,なし,HPリンクエラー,エネルギー業界
ユニバーサルエコロジー株式会社,,https://unieco.co.jp/company/profile/,https://unieco.co.jp/contact/general/,営業お断り,エネルギー業界
太洋商事株式会社,,https://taiyocorp.jp/company/,https://taiyocorp.jp/contact/,,エネルギー業界
ENEOSオーシャン株式会社,,https://www.oc.eneos.co.jp/company/profile.html,なし,,エネルギー業界
小田原ガスライフパートナーズ株式会社,,http://seishogas.com/,なし,HPリンクエラー,エネルギー業界
ENEOSリニューアブル・エナジ株式会社,,https://www.eneos-re.com/company/profile/,https://www.eneos-re.com/inquiry/contact/,,エネルギー業界
株式会社ライオンプロパティ,,https://lion-p.com/,なし,,エネルギー業界
MSエネルシア株式会社,,https://ms-enelucia.com/#company,なし,,エネルギー業界
株式会社エネウィル,,https://enewill.com/aboutus/profile/,https://form.enewill.com/inquiry-enewill,,エネルギー業界
リコアス株式会社,,https://ricoas.co.jp/index.html,https://ricoas.co.jp/contact/,,エネルギー業界
株式会社アイ・グリッド・ソリューションズ,,https://www.igrid.co.jp/company/#about,https://www.igrid.co.jp/contact/other/,,エネルギー業界
株式会社ジーヴァエナジー,,http://www.zivaenergy.com/company1.html,http://www.zivaenergy.com/contact.html,,エネルギー業界
株式会社ユーラスエナジーホールディングス,,https://www.eurus-energy.com/company/outline.html,https://www.eurus-energy.com/contact/input,,エネルギー業界
株式会社ENEOSフィーチャス,,https://eneos-rs.co.jp/company/,なし,,エネルギー業界
株式会社A&T Power Solutions,,https://at-ps.co.jp/,https://at-ps.co.jp/contact/,,エネルギー業界
Trevi Systems Japan合同会社,,https://www.trevisystems.com/japan,https://www.trevisystems.com/contact,,エネルギー業界
株式会社アベニールプロテクト,,https://www.avenirprotect.com/,なし,,エネルギー業界
北海道再エネアグリゲーション株式会社,,https://www.hepco.co.jp/info/2024/1252738_2023.html,https://www1.hepco.co.jp/cgi-bin/network/mail/inputform.cgi?id=other,,エネルギー業界
RE電力株式会社,,https://re-den.jp/,https://re-den.jp/company/#contact,,エネルギー業界
美浜ガス株式会社,,https://mihamagas.com/%E4%BC%9A%E7%A4%BE%E6%A6%82%E8%A6%81/,https://mihamagas.com/%e3%81%8a%e5%95%8f%e3%81%84%e5%90%88%e3%82%8f%e3%81%9b/,,エネルギー業界
沼津酸素工業株式会社,,http://www.numasan.com/?page_id=8,なし,,エネルギー業界
株式会社デイトナ,,https://corporate.daytona.co.jp/company/outline.html,https://corporate.daytona.co.jp/form/,,エネルギー業界
株式会社GASGASエネルギー,,https://gas777.jp/,https://gas777.jp/contact/,,エネルギー業界
新菱液化ガス株式会社,,https://www.shinryou-gas.co.jp/kigyouzyouhou/company-info.html,https://www.shinryou-gas.co.jp/otoiawase/form3.html,,エネルギー業界
三原産業株式会社,,https://www.e-mihara.info/company/gaiyou.html,なし,,エネルギー業界
株式会社アドバンテック,,https://www.advantec-japan.co.jp/company/detail.html,https://www.advantec-japan.co.jp/contact/,,エネルギー業界
エネロ株式会社,,http://enero.co.jp/company/company.html,http://enero.co.jp/contact.html,,エネルギー業界
四国メーコー株式会社,,https://www.shikoku-meiko.co.jp/company/,https://www.shikoku-meiko.co.jp/inquiry/,,エネルギー業界
土佐酸素株式会社,,http://www.tosasanso.co.jp/corporate.html,http://www.tosasanso.co.jp/contact.html,,エネルギー業界
株式会社マイサン,,https://www.yamasan-grp.co.jp/business/energy/kinki_shikoku/,https://www.yamasan-grp.co.jp/contact/,,エネルギー業界
株式会社藤田商店,,https://fujita-group.xsrv.jp/about.html,https://fujita-group.xsrv.jp/contact.html,,エネルギー業界
四国電力株式会社,,https://www.yonden.co.jp/corporate/yonden/summary/index.html,https://www.yonden.co.jp/inquiry/other/index.html,,エネルギー業界
釧路コールマイン株式会社,,http://www.k-coal.co.jp/company.html,なし,,エネルギー業界
大東石油販売株式会社,,http://daito-oil.co.jp/?page_id=14,http://daito-oil.co.jp/?page_id=80,,エネルギー業界
旭川ガス燃料株式会社,,https://asahikawa-gas.co.jp/?page_id=19,https://asahikawa-gas.co.jp/?page_id=210,,エネルギー業界
株式会社マツネン,,http://www.matsu-nen.co.jp/menu/summary.html,なし,,エネルギー業界
GPSSエンジニアリング株式会社,,https://gpsseng.com/about-us/,https://gpsseng.com/contact/,,エネルギー業界
株式会社エゾテン,,https://ezoden.jp/company/,https://ezoden.jp/contact/,,エネルギー業界
第一興産株式会社,,https://daiichi-kousan.jp/company,https://daiichi-kousan.jp/inquiry,,エネルギー業界
北海道ニッツウサービス株式会社,,https://nittsu-service.co.jp/about-us/,なし,,エネルギー業界
株式会社当別熱源,,http://t-netsugen.com/%E4%BC%9A%E7%A4%BE%E6%A6%82%E8%A6%81/,https://docs.google.com/forms/d/e/1FAIpQLScEHyVbsCgubFnylAIUeSrDVBxzefpkQcoGtM68i9HT4DibAg/viewform,,エネルギー業界
アヅマ石油荷役サービス株式会社,,http://www.azuma-sekiyuniyaku.co.jp/page/organization/,http://www.azuma-sekiyuniyaku.co.jp/contact/,,エネルギー業界
株式会社エネサンス北海道,,https://www.enessance.co.jp/hokkaido/company/index.html,なし,,エネルギー業界
十和田ガス株式会社,,http://www.towadagas.co.jp/profile.html,なし,,エネルギー業界
有限会社マルナカ燃料,,https://marunakanenryo.com/pages/2/,https://marunakanenryo.com/pages/8/,,エネルギー業界
株式会社相場商店,,https://www.aibashouten.co.jp/company/,なし,,エネルギー業界
太平熔材株式会社,,https://www.taihei-y.co.jp/info/index.html,https://www.taihei-y.co.jp/contact/index.html,,エネルギー業界
水沢ガス株式会社,,https://www.mizgas.jp/,https://www.mizgas.jp/contact,,エネルギー業界
株式会社ウッティかわい,,https://w-kawai.co.jp/company/#outline,https://w-kawai.co.jp/contact/,,エネルギー業界
盛岡ガス株式会社,,https://www.morioka-gas.co.jp/about/,https://www.morioka-gas.co.jp/web-contact/,,エネルギー業界
株式会社三田商店,,https://www.mita-gnet.co.jp/company1.html,https://www.mita-gnet.co.jp/contact/contact.html,営業お断り,エネルギー業界
サミット酒田パワー株式会社,,https://summit-sakata-power.co.jp/company/,https://summit-sakata-power.co.jp/inquiry/,,エネルギー業界
小笠原商事株式会社,,http://www.ogasawara-shouji.co.jp/corporate/#c2,なし,,エネルギー業界
相馬エネルギーパーク合同会社,,https://soma.energy-park.jp/company/index.html,なし,,エネルギー業界
相馬ガス株式会社,,http://www.somagas.jp/company/com_a03,https://somagas.securesite.jp/site/contact,,エネルギー業界
常盤興産株式会社,,https://www.joban-kosan.com/,なし,,エネルギー業界
林サッシ工業株式会社,,http://hayashi-s.co.jp/company/profile/,http://hayashi-s.co.jp/contact/,,エネルギー業界
佐藤燃料株式会社,,https://www.satonenryo.com/profile,https://www.satonenryo.com/contact,,エネルギー業界
株式会社アポロガス,,https://www.apollo-group.co.jp/group/apollogas.html,https://www.apollo-group.co.jp/contact/gas.html,,エネルギー業界
宜野湾ガス株式会社,,https://ginowan-gas.com/about/info/,なし,,エネルギー業界
ひまわりガス株式会社,,https://www.himawarigas.co.jp/company/,https://www.himawarigas.co.jp/contact/,,エネルギー業界
東洋興産株式会社,,https://www.toyokosan.co.jp/aboutus.php,なし,,エネルギー業界
九州エナジー株式会社,,https://kyushu-energy.co.jp/about/,https://kyushu-energy.co.jp/contact/,,エネルギー業界
株式会社JAエコパル,,https://jaecopal.jp/about,https://jaecopal.jp/about,,エネルギー業界
株式会社コーアガス日本,,https://www.koagas-n.co.jp/coporeate/,https://www.koagas-n.co.jp/toiawase/,,エネルギー業界
株式会社共栄,,https://kyoeinet.co.jp/%E4%BC%9A%E7%A4%BE%E6%A6%82%E8%A6%81/,なし,,エネルギー業界
大徳物産株式会社,,https://daitoku-b.co.jp/info.html,なし,,エネルギー業界
株式会社トスプロ,,https://www.tosu-pro.co.jp/company/,https://www.tosu-pro.co.jp/contact/?m=reform,,エネルギー業界
株式会社クロサキ,,http://www.kk-kurosaki.co.jp/company.html,https://kk-kurosaki.jp/contact/,,エネルギー業界
株式会社筑豊商会,,https://www.chikuho.jp/about,https://www.chikuho.jp/contact.php?do=input&token=0b9dcdb53471eeda2feba9bfd976e821532d2f6a594805290573c44bb098b05d,,エネルギー業界
福豊帝酸株式会社,,https://fukutei.co.jp/company-info/,https://fukutei.co.jp/contact_form/,,エネルギー業界
株式会社吉田酸素,,https://www.y-oxygen.co.jp/corporate_profile,なし,HPリンクエラー,エネルギー業界
株式会社新出光,,https://www.idex.co.jp/company/outline/index.html,https://www.idex.co.jp/inquiry/,,エネルギー業界
新美和石油株式会社,,https://www.sun-energy.co.jp/company/address/shinmiwa.html,なし,,エネルギー業界
山代ガス福岡株式会社,,https://ygas.jp/company/,https://ygas.jp/meyasubako/,,エネルギー業界
株式会社JA中央サービス,,https://kjacs.com/index.htm/kaishyagaiyou.html,なし,,エネルギー業界
米子瓦斯株式会社,,https://www.yonago-gas.co.jp/index.php?view=5426,https://www.yonago-gas.co.jp/mailform.php,,エネルギー業界
株式会社ジョモネット山陰,,https://jomonet-sanin.jp/company/,https://jomonet-sanin.jp/contact/,,エネルギー業界
株式会社イースト・エンジニアリング,,https://east-e.co.jp/company/index.html,https://east-e.co.jp/contact/index.html,,エネルギー業界
株式会社大平,,https://e-ohira.co.jp/,なし,,エネルギー業界
田中実業 株式会社,,http://www.tanaka-jitsugyo.co.jp/company.html,なし,,エネルギー業界
株式会社ワカサ,,https://wakasa-e.co.jp/company/,https://wakasa-e.co.jp/form-1/contact_business/,,エネルギー業界
西日本液化ガス株式会社,,https://www.nishieki.co.jp/company/gaiyou.html,なし,,エネルギー業界
山口産業株式会社,,https://www.yamasan-grp.co.jp/business/energy/all/,https://www.yamasan-grp.co.jp/contact/,,エネルギー業界
中国アセチレン株式会社,,https://chuase.net/about/,https://chuase.net/contact/,,エネルギー業界
株式会社ゴールドフォレスト,,http://takumizouen.jp/index.html,なし,,エネルギー業界
株式会社 グリーンエネルギー北陸,,https://www.geh.co.jp/company/,https://www.geh.co.jp/contact/,,エネルギー業界
株式会社フェイス,,https://faith-toyama.com/company,https://faith-toyama.com/cntct,,エネルギー業界
有限会社矢田郷商店,,https://yatagou.co.jp/company,https://yatagou.co.jp/contact,,エネルギー業界
株式会社上村産業,,https://uemurasangyo.jp/company-profile/,https://uemurasangyo.jp/contact/,,エネルギー業界
小松ガス株式会社,,https://komatsugas.co.jp/company/,なし,,エネルギー業界
砂山商事株式会社,,https://sunayamanet.jp/company/,https://sunayamanet.jp/contact/,,エネルギー業界
越前エネライン株式会社,,http://www.echizen-eneline.co.jp/corporate/,なし,,エネルギー業界
クリーンガス福井株式会社,,https://cleangas.jp/,https://cleangas.jp/newcontact/contact_other.php,,エネルギー業界
日比野工業株式会社,,http://www.hibinolime.co.jp/company.html,http://www.hibinolime.co.jp/contact.html,,エネルギー業界
川越ガス株式会社,,https://www.kawagoe-gas.co.jp/company/index.html,なし,,エネルギー業界
株式会社トヨタエナジーソリューションズ,,https://www.toyota-energy.co.jp/profile/,https://www.toyota-energy.co.jp/contact/,,エネルギー業界
株式会社フェイスホールディングス,,https://facejapan-mie.com/company/,なし,,エネルギー業界
株式会社ホームエネルギー東海,,https://www.home-energy.jp/network/09tokai.html,なし,,エネルギー業界
株式会社エイチティーピー,,https://www.htp-h.co.jp/contents/corporate.html,なし,,エネルギー業界
犬山ガス株式会社,,https://www.inym-gas.co.jp/company/overview/,なし,,エネルギー業界
株式会社成田セラミックバーナー工業所,,http://www.narita-cbi.com/company.html,http://www.narita-cbi.com/inquiry.html,,エネルギー業界
株式会社日本開発,,http://nihonkaihatu.co.jp/company/,なし,,エネルギー業界
豊通エネルギー株式会社,,https://www.toyotsuene.co.jp/aboutus/corporateprofile/,https://www.toyotsuene.co.jp/contactus/,,エネルギー業界
豊田ケミカルエンジニアリング株式会社,,https://www.toyochemi.co.jp/company/,https://www.toyochemi.co.jp/contact/form.cgi,,エネルギー業界
東邦液化ガス株式会社,,https://www.tohoekika.jp/company/gaiyo.html,なし,,エネルギー業界
中電配電サポート株式会社,,https://chuden-hs.co.jp/outline/company/,https://chuden-hs.co.jp/contact/,,エネルギー業界
ダイワエネルギー株式会社,,https://www.daiwalpg.com/company/,なし,,エネルギー業界
株式会社エヌアンドエス,,https://www.nands.jp/overview/,https://www.nands.jp/form/form_1.html,,エネルギー業界
三和石油ガス株式会社,,http://www.sanwasekiyugas.com/company/,http://www.sanwasekiyugas.com/contact/,,エネルギー業界
桜井ガス株式会社,,https://www.sakurai-gas.co.jp/kigyou/kigyou.html,なし,,エネルギー業界
井本産業株式会社,,http://www.imotosangyo.jp/company.html,http://www.imotosangyo.jp/inquiry.html,,エネルギー業界
三木産業株式会社,,http://www.mikisangyo-grp.co.jp/kaisyaannai/kaisya-gaiyou.html,なし,,エネルギー業界
高浜酸素株式会社,,https://i-sanso.jp/pages/2/,https://i-sanso.jp/pages/7/,営業お断り,エネルギー業界
株式会社快英社,,https://www.airwel.jp/corp/outline/,https://www.airwel.jp/contact/,,エネルギー業界
株式会社大岡酸素商会,,https://oooka.co.jp/,https://oooka.co.jp/contact/,,エネルギー業界
兵庫パルプ工業株式会社,,https://www.hyogopulp.co.jp/company/index.html,https://www.hyogopulp.co.jp/inquiry/index.html,,エネルギー業界
藤田酸素工業株式会社,,https://www.fujita-sanso.co.jp/company/,https://www.fujita-sanso.co.jp/contact/,,エネルギー業界
神鋼エアーテック株式会社,,https://shinko-airtech.com/company_01.html,https://shinko-airtech.com/inquiry.html,,エネルギー業界
シンコーケミカル・ターミナル株式会社,,https://www.shinkochemical.co.jp/company/,https://www.shinkochemical.co.jp/contact.html,,エネルギー業界
有限会社辻久ガス,,https://tsujikyu.jp/about/,なし,,エネルギー業界
